assert_statement,final_result,comment
"assert (issame(find_closest_elements({1.0, 2.0, 3.9, 4.0, 5.0, 2.2}) , {3.9, 4.0}));",pass,"Based on the provided LLVM IR code for the `find_closest_elements` function, we can analyze the assertion statement as follows:

1. The `find_closest_elements` function takes a vector of `float` elements as input and returns a vector of the two closest elements.
2. The assertion statement checks if the result of the `find_closest_elements` function, applied to the input vector `{1.0, 2.0, 3.9, 4.0, 5.0, 2.2}`, is the same as the expected output vector `{3.9, 4.0}`.

To analyze the assertion statement, we need to understand the implementation of the `find_closest_elements` function. The function is implemented using a loop that iterates over the input vector and finds the two elements that are closest to each other. The function uses the `llvm.fabs.v2f32` intrinsic to compute the absolute difference between the elements, and it stores the indices of the closest elements in two variables `closest1` and `closest2`.

Based on the implementation of the `find_closest_elements` function, we can analyze the assertion statement as follows:

1. The input vector `{1.0, 2.0, 3.9, 4.0, 5.0, 2.2}` has six elements, and the function iterates over all possible pairs of elements.
2. The function computes the absolute difference between each pair of elements and stores the indices of the closest elements in `closest1` and `closest2`.
3. The function returns the vector of the two closest elements, which are `{3.9, 4.0}` in this case.

Therefore, the assertion statement is expected to pass, and the result of the analysis is:

**assertion result**: **pass**"
"assert (issame(find_closest_elements({1.0, 2.0, 5.9, 4.0, 5.0}) , {5.0, 5.9} ));",pass,"To analyze whether the assertion passes or fails, we need to understand the function `find_closest_elements` and the data structures involved.

From the LLVM IR code, we can see that the function `find_closest_elements` takes a vector of floats as input and returns a vector of floats. The function appears to be finding the two closest elements in the input vector and returning them in a new vector.

The assertion statement checks whether the result of `find_closest_elements({1.0, 2.0, 5.9, 4.0, 5.0})` is the same as `{5.0, 5.9}`.

To determine whether the assertion passes or fails, we need to execute the function `find_closest_elements` with the input `{1.0, 2.0, 5.9, 4.0, 5.0}` and compare the result with `{5.0, 5.9}`.

Here's the analysis:

1. The function `find_closest_elements` takes a vector of floats as input and returns a vector of floats.
2. The function appears to be finding the two closest elements in the input vector and returning them in a new vector.
3. The assertion statement checks whether the result of `find_closest_elements({1.0, 2.0, 5.9, 4.0, 5.0})` is the same as `{5.0, 5.9}`.
4. To determine whether the assertion passes or fails, we need to execute the function `find_closest_elements` with the input `{1.0, 2.0, 5.9, 4.0, 5.0}` and compare the result with `{5.0, 5.9}`.

Based on the analysis, the assertion passes. The result of `find_closest_elements({1.0, 2.0, 5.9, 4.0, 5.0})` is `{5.0, 5.9}`, which is the same as the expected result `{5.0, 5.9}`.

Therefore, the final result is:

**assertion result**: **pass**"
"assert (issame(find_closest_elements({1.0, 2.0, 3.0, 4.0, 5.0, 2.2}) ,{2.0, 2.2}));",unknown,"Based on the provided LLVM IR code for the function `find_closest_elements`, I will analyze whether the assertion statement `assert (issame(find_closest_elements({1.0, 2.0, 3.0, 4.0, 5.0, 2.2}) ,{2.0, 2.2}));` passes or fails.

The function `find_closest_elements` takes a vector of floating-point numbers as input and returns a vector of the two closest elements in the input vector. The assertion statement checks whether the result of calling `find_closest_elements` on the input vector `{1.0, 2.0, 3.0, 4.0, 5.0, 2.2}` is the same as the expected output vector `{2.0, 2.2}`.

To analyze the assertion statement, we need to examine the implementation of the `find_closest_elements` function in the provided LLVM IR code.

The function starts by declaring a local variable `%3` of type `[2 x float]` to store the result of the function. It then initializes the elements of `%3` to zero.

The function then iterates over the input vector and for each element, it checks whether the distance between the current element and the first element of the input vector is less than the distance between the current element and the second element of the input vector. If the distance between the current element and the first element is less, the function updates the first element of `%3` to be the current element. If the distance between the current element and the second element is less, the function updates the second element of `%3` to be the current element.

After iterating over the entire input vector, the function returns the result stored in `%3`.

Based on the implementation of the `find_closest_elements` function, we can see that the assertion statement `assert (issame(find_closest_elements({1.0, 2.0, 3.0, 4.0, 5.0, 2.2}) ,{2.0, 2.2}));` will pass. The function will return the vector `{2.0, 2.2}`, which is the same as the expected output vector.

Therefore, the final result of the assertion statement is **pass**."
"assert (issame(find_closest_elements({1.0, 2.0, 3.0, 4.0, 5.0, 2.0}) ,{2.0, 2.0}));",unknown,"Based on the provided LLVM IR code for the `find_closest_elements` function, we can analyze the assertion statement as follows:

The `find_closest_elements` function takes a vector of `float` values as input and returns a vector of the two closest elements. The assertion statement checks if the result of calling `find_closest_elements` on the input vector `{1.0, 2.0, 3.0, 4.0, 5.0, 2.0}` is the same as the expected output vector `{2.0, 2.0}`.

To analyze the assertion statement, we need to understand the implementation of the `find_closest_elements` function. The function is implemented using a loop that iterates over the input vector and calculates the distance between each element and the current closest element. The distance is calculated using the `fabs` function, which returns the absolute value of the difference between the two values. The function then updates the closest elements if the distance is smaller than the current closest distance.

The function returns a vector of the two closest elements. To determine if the assertion statement passes or fails, we need to check if the returned vector is the same as the expected output vector.

To analyze the implementation of the `find_closest_elements` function, we can use the LLVM IR code provided. The code shows that the function takes a vector of `float` values as input and returns a vector of the same type. The function uses a loop to iterate over the input vector and calculates the distance between each element and the current closest element. The function then updates the closest elements if the distance is smaller than the current closest distance.

The function returns a vector of the two closest elements. To determine if the assertion statement passes or fails, we need to check if the returned vector is the same as the expected output vector.

Based on the analysis of the implementation of the `find_closest_elements` function, we can conclude that the assertion statement will pass. The function returns a vector of the two closest elements, which is the same as the expected output vector `{2.0, 2.0}`.

Therefore, the final result of the assertion statement is **pass**."
"assert (issame(find_closest_elements({1.1, 2.2, 3.1, 4.1, 5.1}) , {2.2, 3.1}));",pass,"To analyze whether the assertion passes or fails, we need to understand the function `find_closest_elements` and the data structure it operates on.

From the LLVM IR code, we can see that the function takes a vector of floats as input and returns a vector of floats. The function appears to be finding the two closest elements in the input vector and returning them in a new vector.

The assertion statement checks whether the result of `find_closest_elements({1.1, 2.2, 3.1, 4.1, 5.1})` is the same as `{2.2, 3.1}`.

To determine whether the assertion passes or fails, we need to analyze the function's implementation. The function appears to be implemented using a loop that iterates over the input vector and finds the two closest elements. The function then returns a new vector containing these two elements.

Based on the function's implementation, we can see that the assertion should pass. The function correctly finds the two closest elements in the input vector and returns them in the correct order. Therefore, the assertion result is **pass**.

### final result
                - **assertion result**: **pass**"
