assert_statement,final_result,comment
"assert (how_many_times("""", ""x"") == 0);",unknown,"**Thinking Process**

1. The assertion statement is `assert (how_many_times("""", ""x"") == 0);`.
2. The function `how_many_times` takes two string arguments and returns the number of times the second string appears in the first string.
3. In this case, the first string is an empty string `""""`, and the second string is `""x""`.
4. The function `how_many_times` will return 0, since the second string does not appear in the first string.
5. Therefore, the assertion statement should pass.

**Final Result**

* Assertion result: **pass**"
"assert (how_many_times(""xyxyxyx"", ""x"") == 4);",pass,"To analyze whether the assertion passes or fails, we need to understand the function `how_many_times` and the input parameters.

The function `how_many_times` takes two string parameters, `n` and `s`, and returns the number of times the string `s` appears in the string `n`. The function is defined in the LLVM IR code provided.

The input parameters for the assertion are `""xyxyxyx""` and `""x""`. The expected result of the assertion is `4`, which means the string `""x""` appears four times in the string `""xyxyxyx""`.

To determine whether the assertion passes or fails, we need to execute the function `how_many_times` with the input parameters and compare the result with the expected result.

Here's the thinking process:

1. The function `how_many_times` is defined in the LLVM IR code provided.
2. The function takes two string parameters, `n` and `s`, and returns the number of times the string `s` appears in the string `n`.
3. The input parameters for the assertion are `""xyxyxyx""` and `""x""`.
4. The expected result of the assertion is `4`, which means the string `""x""` appears four times in the string `""xyxyxyx""`.
5. To determine whether the assertion passes or fails, we need to execute the function `how_many_times` with the input parameters and compare the result with the expected result.

Based on the above analysis, the assertion passes. The result of the assertion is `4`, which is equal to the expected result.

Therefore, the final result is:

**assertion result**: **pass**"
"assert (how_many_times(""cacacacac"", ""cac"") == 4);",fail,"To analyze whether the assertion passes or fails, we need to understand the logic of the `how_many_times` function.

The `how_many_times` function takes two string arguments, `n` and `s`, and returns the number of times that the string `s` appears in the string `n`. The function uses a loop to iterate over the characters of `n`, and for each character, it checks if it matches the first character of `s`. If it does, it increments a counter, and then checks if the remaining characters of `n` match the remaining characters of `s`. If they do, it increments the counter again.

The function returns the final value of the counter, which represents the number of times that `s` appears in `n`.

Now, let's analyze the assertion statement:
```
assert (how_many_times(""cacacacac"", ""cac"") == 4);
```
The assertion statement checks if the result of `how_many_times(""cacacacac"", ""cac"")` is equal to 4.

To evaluate the assertion, we need to understand the logic of the `how_many_times` function. We can see that the function uses a loop to iterate over the characters of `n`, and for each character, it checks if it matches the first character of `s`. If it does, it increments a counter, and then checks if the remaining characters of `n` match the remaining characters of `s`. If they do, it increments the counter again.

In this case, the string `n` is ""cacacacac"", and the string `s` is ""cac"". The function will iterate over the characters of `n`, and for each character, it will check if it matches the first character of `s`, which is 'c'. Since the first character of `n` is 'c', the function will increment the counter.

The function will then check if the remaining characters of `n` match the remaining characters of `s`. Since the remaining characters of `n` are ""acacac"", and the remaining characters of `s` are ""ac"", the function will not find a match, and it will not increment the counter again.

Therefore, the result of `how_many_times(""cacacacac"", ""cac"")` is 1, not 4. The assertion statement will fail.

Here's the final result:

* **assertion result**: **fail**"
"assert (how_many_times(""john doe"", ""john"") == 1);",pass,"To analyze whether the assertion passes or fails, we need to understand the semantics of the function `how_many_times` and the input arguments.

From the LLVM IR code, we can see that the function `how_many_times` takes two arguments of type `std::__cxx11::basic_string<char>`, and returns an integer value. The function appears to be a member function of a class, and its name suggests that it counts the number of times a substring appears in a given string.

The assertion statement checks whether the result of calling `how_many_times` with the arguments `""john doe""` and `""john""` is equal to 1.

To determine whether the assertion passes or fails, we need to analyze the implementation of the `how_many_times` function. The function appears to be implemented in the same module as the assertion statement, so we can analyze the function's implementation in the provided LLVM IR code.

The `how_many_times` function appears to be implemented using a loop that iterates over the characters of the input string. The loop checks whether the current character is equal to the first character of the substring, and if so, it increments a counter. The function returns the value of the counter.

Based on this analysis, we can determine that the assertion statement will pass if the substring `""john""` appears exactly once in the input string `""john doe""`. If the substring appears more or fewer times, the assertion will fail.

Therefore, the final result of the assertion is:

* **assertion result**: **pass**"
